{
  "$schema": "https://json-schema.org/draft/2020-12/schema",
  "$id": "script.schema.json",
  "schema_version": "1.0.0",
  "type": "object",
  "additionalProperties": false,
  "required": ["schema_version", "format", "treatment", "hook", "narration_beats",
               "captions", "music", "platform_meta", "claims", "disclaimer", "layout_data"],
  "properties": {
    "schema_version": {"type": "string"},
    "format": {"type": "string"},
    "treatment": {
      "type": "object", "additionalProperties": false,
      "required": ["thesis", "angle", "tone", "visual_motif", "energy_curve"],
      "properties": {
        "thesis": {"type": "string"}, "angle": {"type": "string"}, "tone": {"type": "string"},
        "visual_motif": {"type": "array", "items": {"type": "string"}},
        "energy_curve": {"type": "array", "items": {"type": "number"}}
      }
    },
    "hook": {
      "type": "object", "additionalProperties": false,
      "required": ["spoken", "on_screen_text", "first_frame_visual", "duration"],
      "properties": {
        "spoken": {"type": "string"}, "on_screen_text": {"type": "string"},
        "first_frame_visual": {"type": "string"}, "duration": {"type": "number"}
      }
    },
    "hook_variants": {
      "type": "array",
      "items": {
        "type": "object", "additionalProperties": false,
        "required": ["spoken", "score"],
        "properties": {"spoken": {"type": "string"}, "score": {"type": "number"}}
      }
    },
    "narration_beats": {
      "type": "array",
      "items": {
        "type": "object", "additionalProperties": false,
        "required": ["text"],
        "properties": {
          "text": {"type": "string"},
          "prosody": {"type": "string"},
          "emphasis": {"type": "array", "items": {"type": "string"}}
        }
      }
    },
    "captions": {
      "type": "array",
      "items": {
        "type": "object", "additionalProperties": false,
        "required": ["text"],
        "properties": {"text": {"type": "string"},
                       "emphasis": {"type": "array", "items": {"type": "string"}}}
      }
    },
    "music": {
      "type": "object", "additionalProperties": false,
      "required": ["mood", "energy"],
      "properties": {"mood": {"type": "string"}, "energy": {"type": "string"}}
    },
    "platform_meta": {
      "type": "object",
      "additionalProperties": {
        "type": "object", "additionalProperties": false,
        "required": ["title", "description", "hashtags"],
        "properties": {
          "title": {"type": "string"}, "description": {"type": "string"},
          "hashtags": {"type": "array", "items": {"type": "string"}}
        }
      }
    },
    "claims": {
      "type": "array",
      "items": {
        "type": "object", "additionalProperties": false,
        "required": ["value", "source_ref"],
        "properties": {"value": {"type": "string"}, "source_ref": {"type": "string"}}
      }
    },
    "disclaimer": {"type": "string"},
    "primary_keyword": {"type": "string"},
    "affiliate": {"type": "object"},
    "layout_data": {
      "description": "per-beat structured data keyed to the format (ADR 0007 D3 / 0007a §7b)",
      "oneOf": [
        {
          "type": "object", "additionalProperties": false,
          "required": ["kind", "items"],
          "properties": {
            "kind": {"const": "ranked_list"},
            "items": {
              "type": "array",
              "items": {
                "type": "object", "additionalProperties": false,
                "required": ["rank", "title", "body", "media_query"],
                "properties": {
                  "rank": {"type": "integer"}, "title": {"type": "string"},
                  "body": {"type": "string"}, "media_query": {"type": "string"},
                  "stat": {"type": "string"}
                }
              }
            }
          }
        },
        {
          "type": "object", "additionalProperties": false,
          "required": ["kind", "side_a", "side_b", "verdict", "round"],
          "properties": {
            "kind": {"const": "head_to_head"},
            "side_a": {"$ref": "#/$defs/side"},
            "side_b": {"$ref": "#/$defs/side"},
            "verdict": {"type": "object", "additionalProperties": false,
                        "required": ["text"], "properties": {"text": {"type": "string"}}},
            "round": {"type": "array", "items": {
              "type": "object", "additionalProperties": false,
              "required": ["metrics"],
              "properties": {"metrics": {"type": "object"}}}}
          }
        }
      ]
    }
  },
  "$defs": {
    "side": {
      "type": "object", "additionalProperties": false,
      "required": ["media_query", "label"],
      "properties": {"media_query": {"type": "string"}, "label": {"type": "string"}}
    }
  }
}
